{
  "1": { "value": "34ch", "type": "sizing", "description": "Cards, sidebars, marginalia." },
  "2": { "value": "48ch", "type": "sizing", "description": "Short text blocks, captions." },
  "3": { "value": "60ch", "type": "sizing", "description": "Base editorial reading measure." },
  "4": { "value": "72ch", "type": "sizing", "description": "Long-form articles." },
  "5": { "value": "84ch", "type": "sizing", "description": "Widest long-form measure." }
}
